"Symfony Parte 1: Criação de uma API Restful";Sim
"Symfony Parte 2: Autenticação e HATEOAS";Sim
"PHP Doctrine: Introdução ao Mapeamento Objeto-Relacional";Sim
"Laravel parte 1: Produtividade no desenvolvimento web";Sim
"Laravel parte 2: Trabalhando com Autenticação, Relacionamentos e Testes";Sim
"Lumen: API Rest com o Micro-framework do Laravel";Sim
"Introdução ao PHP: Primeiros passos com a linguagem";Sim
"Avançando com PHP: Arrays, Strings, Função e Web";Sim
"MVC com PHP: Entenda o padrão Model-View-Controller";Sim
"PHP Composer: Dependências, Autoload e Publicação";Sim
"PHP e TDD : Testes com PHPUnit";Sim
;Sim
"CURSO DE ARQUIVOS COM PHP 3";Sim
"CURSO DE ARQUIVOS COM PHP 4Vinicius Trecenti de Araujo";Sim
;Sim
"TESTE DE PHP PELO TECLADO";Sim
